{
  "format": "life-agent-notes",
  "format_version": "1.0.0",
  "events": [
    {
      "event_id": "20000000-0000-4000-8000-000000000001",
      "current_revision_id": "30000000-0000-4000-8000-000000000002"
    },
    {
      "event_id": "20000000-0000-4000-8000-000000000002",
      "current_revision_id": "30000000-0000-4000-8000-000000000004"
    }
  ],
  "revisions": [
    {
      "schema_version": "4.0.0",
      "persistence_state": "local_pending",
      "identity": {
        "installation_id": "10000000-0000-4000-8000-000000000001",
        "local_owner_id": "10000000-0000-4000-8000-000000000002",
        "device_id": null
      },
      "event_id": "20000000-0000-4000-8000-000000000001",
      "revision_id": "30000000-0000-4000-8000-000000000001",
      "revision_no": 1,
      "kind": "note",
      "assertion_status": "observed",
      "lifecycle": null,
      "record_status": "active",
      "verification_status": "user_confirmed",
      "source": {
        "capture_id": "40000000-0000-4000-8000-000000000001",
        "operation_id": "50000000-0000-4000-8000-000000000001",
        "channel": "android_manual",
        "source_record_id": null,
        "source_record_version": null,
        "source_modified_at": null,
        "recorded_at": "2026-01-10T10:00:00Z",
        "origin": {
          "provider": null,
          "app": "Life Agent fixture",
          "device": "fixture-device",
          "user_entered": true
        },
        "collector": {
          "name": "life-agent-android",
          "version": "0.1.0"
        }
      },
      "time": {
        "effective_start_utc": "2026-01-10T10:00:00Z",
        "effective_end_utc": null,
        "original_local_start": "2026-01-10T10:00:00",
        "original_local_end": null,
        "timezone_id": "Etc/UTC",
        "start_offset_seconds": 0,
        "end_offset_seconds": null,
        "temporal_precision": "minute",
        "local_date": "2026-01-10",
        "source_expression": null
      },
      "payload": {
        "text": "Первая синтетическая заметка."
      },
      "evidence": [
        {
          "capture_ref": "#/source/capture_id",
          "field_path": "/payload/text",
          "artifact_id": null,
          "locator": "android_form:/note/text",
          "excerpt": null,
          "human_confirmed": true
        }
      ],
      "quality_flags": [],
      "revision": {
        "created_at": "2026-01-10T10:00:00Z",
        "content_sha256": "dc326d81f86d371c6523eb875ac9f899506e89841e12e27684ca200bce9d5eca",
        "actor": "user",
        "correction_reason": null,
        "parents": []
      },
      "server": {
        "received_at": null,
        "server_sequence": null
      }
    },
    {
      "schema_version": "4.0.0",
      "persistence_state": "local_pending",
      "identity": {
        "installation_id": "10000000-0000-4000-8000-000000000001",
        "local_owner_id": "10000000-0000-4000-8000-000000000002",
        "device_id": null
      },
      "event_id": "20000000-0000-4000-8000-000000000001",
      "revision_id": "30000000-0000-4000-8000-000000000002",
      "revision_no": 2,
      "kind": "note",
      "assertion_status": "observed",
      "lifecycle": null,
      "record_status": "active",
      "verification_status": "user_confirmed",
      "source": {
        "capture_id": "40000000-0000-4000-8000-000000000002",
        "operation_id": "50000000-0000-4000-8000-000000000002",
        "channel": "android_manual",
        "source_record_id": null,
        "source_record_version": null,
        "source_modified_at": null,
        "recorded_at": "2026-01-10T10:01:00Z",
        "origin": {
          "provider": null,
          "app": "Life Agent fixture",
          "device": "fixture-device",
          "user_entered": true
        },
        "collector": {
          "name": "life-agent-android",
          "version": "0.1.0"
        }
      },
      "time": {
        "effective_start_utc": "2026-01-10T10:00:00Z",
        "effective_end_utc": null,
        "original_local_start": "2026-01-10T10:00:00",
        "original_local_end": null,
        "timezone_id": "Etc/UTC",
        "start_offset_seconds": 0,
        "end_offset_seconds": null,
        "temporal_precision": "minute",
        "local_date": "2026-01-10",
        "source_expression": null
      },
      "payload": {
        "text": "Исправленная синтетическая заметка с символами: кавычки «» и emoji 🌿."
      },
      "evidence": [
        {
          "capture_ref": "#/source/capture_id",
          "field_path": "/payload/text",
          "artifact_id": null,
          "locator": "android_form:/note/text",
          "excerpt": null,
          "human_confirmed": true
        }
      ],
      "quality_flags": [],
      "revision": {
        "created_at": "2026-01-10T10:01:00Z",
        "content_sha256": "5a8a34c01819682a6d530e6d94e59c9f277b895789b9175abad473cce2b67907",
        "actor": "user",
        "correction_reason": "Исправление fixture",
        "parents": [
          {
            "revision_id": "30000000-0000-4000-8000-000000000001",
            "relation": "supersedes"
          }
        ]
      },
      "server": {
        "received_at": null,
        "server_sequence": null
      }
    },
    {
      "schema_version": "4.0.0",
      "persistence_state": "local_pending",
      "identity": {
        "installation_id": "10000000-0000-4000-8000-000000000001",
        "local_owner_id": "10000000-0000-4000-8000-000000000002",
        "device_id": null
      },
      "event_id": "20000000-0000-4000-8000-000000000002",
      "revision_id": "30000000-0000-4000-8000-000000000003",
      "revision_no": 1,
      "kind": "note",
      "assertion_status": "observed",
      "lifecycle": null,
      "record_status": "active",
      "verification_status": "user_confirmed",
      "source": {
        "capture_id": "40000000-0000-4000-8000-000000000003",
        "operation_id": "50000000-0000-4000-8000-000000000003",
        "channel": "android_manual",
        "source_record_id": null,
        "source_record_version": null,
        "source_modified_at": null,
        "recorded_at": "2026-01-10T11:00:00Z",
        "origin": {
          "provider": null,
          "app": "Life Agent fixture",
          "device": "fixture-device",
          "user_entered": true
        },
        "collector": {
          "name": "life-agent-android",
          "version": "0.1.0"
        }
      },
      "time": {
        "effective_start_utc": "2026-01-10T11:00:00Z",
        "effective_end_utc": null,
        "original_local_start": "2026-01-10T11:00:00",
        "original_local_end": null,
        "timezone_id": "Etc/UTC",
        "start_offset_seconds": 0,
        "end_offset_seconds": null,
        "temporal_precision": "minute",
        "local_date": "2026-01-10",
        "source_expression": null
      },
      "payload": {
        "text": "Заметка для проверки отмены."
      },
      "evidence": [
        {
          "capture_ref": "#/source/capture_id",
          "field_path": "/payload/text",
          "artifact_id": null,
          "locator": "android_form:/note/text",
          "excerpt": null,
          "human_confirmed": true
        }
      ],
      "quality_flags": [],
      "revision": {
        "created_at": "2026-01-10T11:00:00Z",
        "content_sha256": "bde681c38c60e11f359e87f4f02b8506f4f1d3fbf0b7ce25fd55266e2fce4dff",
        "actor": "user",
        "correction_reason": null,
        "parents": []
      },
      "server": {
        "received_at": null,
        "server_sequence": null
      }
    },
    {
      "schema_version": "4.0.0",
      "persistence_state": "local_pending",
      "identity": {
        "installation_id": "10000000-0000-4000-8000-000000000001",
        "local_owner_id": "10000000-0000-4000-8000-000000000002",
        "device_id": null
      },
      "event_id": "20000000-0000-4000-8000-000000000002",
      "revision_id": "30000000-0000-4000-8000-000000000004",
      "revision_no": 2,
      "kind": "note",
      "assertion_status": "observed",
      "lifecycle": null,
      "record_status": "retracted",
      "verification_status": "user_confirmed",
      "source": {
        "capture_id": "40000000-0000-4000-8000-000000000004",
        "operation_id": "50000000-0000-4000-8000-000000000004",
        "channel": "android_manual",
        "source_record_id": null,
        "source_record_version": null,
        "source_modified_at": null,
        "recorded_at": "2026-01-10T11:01:00Z",
        "origin": {
          "provider": null,
          "app": "Life Agent fixture",
          "device": "fixture-device",
          "user_entered": true
        },
        "collector": {
          "name": "life-agent-android",
          "version": "0.1.0"
        }
      },
      "time": {
        "effective_start_utc": "2026-01-10T11:00:00Z",
        "effective_end_utc": null,
        "original_local_start": "2026-01-10T11:00:00",
        "original_local_end": null,
        "timezone_id": "Etc/UTC",
        "start_offset_seconds": 0,
        "end_offset_seconds": null,
        "temporal_precision": "minute",
        "local_date": "2026-01-10",
        "source_expression": null
      },
      "payload": {
        "text": "Заметка для проверки отмены."
      },
      "evidence": [
        {
          "capture_ref": "#/source/capture_id",
          "field_path": "/payload/text",
          "artifact_id": null,
          "locator": "android_form:/note/text",
          "excerpt": null,
          "human_confirmed": true
        }
      ],
      "quality_flags": [],
      "revision": {
        "created_at": "2026-01-10T11:01:00Z",
        "content_sha256": "c3557a350d87866d1c66c606973cf81d91b4d0309b31b648a5753b2cd1fe4d8a",
        "actor": "user",
        "correction_reason": "Отмена последнего действия",
        "parents": [
          {
            "revision_id": "30000000-0000-4000-8000-000000000003",
            "relation": "supersedes"
          }
        ]